{
  "$schema": "../../../../.agents/skills/fs-cross-review-loop/templates/CROSS-REVIEW-LOOP.schema.json",
  "status": "clean",
  "startedAt": "2026-06-27T09:52:00.000Z",
  "updatedAt": "2026-06-27T09:57:40.000Z",
  "task": "PR #86 feat(gateway): ADR-032 phase 2 post-launch obs-first readiness and delivery",
  "artifactDir": "docs/operations/evidence/adr032",
  "maxCycles": 3,
  "cycles": 1,
  "requiredReviewers": [
    {
      "id": "code-reviewer",
      "label": "Independent code-reviewer subagent",
      "runnerType": "grok",
      "paneId": null
    }
  ],
  "optionalReviewers": [],
  "blockingFindingsOpen": 0,
  "finalVerdict": "clean",
  "stopReason": "Reviewer PASS on merge commit 91674d9; obs-first post-launch paths validated",
  "cycleRecords": [
    {
      "cycle": 1,
      "startedAt": "2026-06-27T09:52:00.000Z",
      "workerReadySignal": "Post-launch obs-first implementation ready",
      "reviewerVerdicts": [
        {
          "reviewerId": "code-reviewer",
          "verdict": "PASS",
          "blockingCount": 0,
          "evidenceReview": "11/11 decision tests + 4/4 safe-send; typecheck green",
          "validationReview": "APPROVE; Gateway + CC CI SUCCESS at merge",
          "outputArtifact": "docs/operations/evidence/adr032/pr86-CROSS-REVIEW-LOOP.json"
        }
      ],
      "findingsSentToWorker": [],
      "workerFixSummary": "selectIdleFromObservabilityAndPane + runnerShowsPromptDeliveryAccepted",
      "validationSummary": "Merged 91674d9fe3cde23a424fd9872a9486f0b81df40d",
      "completedAt": "2026-06-27T09:57:40.000Z"
    }
  ]
}