{
  "$schema": "../../../../.agents/skills/fs-cross-review-loop/templates/CROSS-REVIEW-LOOP.schema.json",
  "status": "clean",
  "startedAt": "2026-06-27T09:20:00.000Z",
  "updatedAt": "2026-06-27T09:33:33.000Z",
  "task": "PR #84 fix(gateway): confirm pane pending after hook acceptance before send",
  "artifactDir": "docs/operations/evidence/adr032",
  "maxCycles": 3,
  "cycles": 1,
  "requiredReviewers": [
    {
      "id": "code-reviewer",
      "label": "Independent code-reviewer subagent",
      "runnerType": "grok",
      "paneId": null
    }
  ],
  "optionalReviewers": [],
  "blockingFindingsOpen": 0,
  "finalVerdict": "clean",
  "stopReason": "Reviewer PASS on merge commit 510297c; stale hook acceptance regression test added",
  "cycleRecords": [
    {
      "cycle": 1,
      "startedAt": "2026-06-27T09:20:00.000Z",
      "workerReadySignal": "Stale hook acceptance pane-confirm fix ready",
      "reviewerVerdicts": [
        {
          "reviewerId": "code-reviewer",
          "verdict": "PASS",
          "blockingCount": 0,
          "evidenceReview": "registry-safe-send 4/4; observability-decision 9/9; e2e and phase-1 gate exit 0",
          "validationReview": "GH formal --approve blocked on self-authored PR; cross-review JSON authoritative",
          "outputArtifact": "docs/operations/evidence/adr032/pr84-CROSS-REVIEW-LOOP.json"
        }
      ],
      "findingsSentToWorker": [],
      "workerFixSummary": "resolvePendingInstructionObsFirst returns fallback when hook reports accepted digest",
      "validationSummary": "Merged 510297c4814a3da2b424c5533bfb58f25c1dc530; CI SUCCESS",
      "completedAt": "2026-06-27T09:33:33.000Z"
    }
  ]
}